<?xml version="1.0" encoding="ISO-8859-1"?>
<!DOCTYPE package SYSTEM "../package.dtd">
<package>

<!--
      Copyright (c) 2002 The Trustees of Indiana University.  
                         All rights reserved.
      
      This file is part of the OSCAR software package.  For license
      information, see the COPYING file in the top level directory of the
      OSCAR source distribution.
     
      $Id: config.xml,v 1.3 2002/11/02 00:45:44 bligneri Exp $
      -->

  <name>loghost</name>

  <version>
    <major>1</major>
    <minor>0</minor>
    <subversion>0</subversion>
    <release>1</release>
    <epoch>1</epoch>
  </version>

  <class>included</class>
  <installable>1</installable>

  <summary>Configures server to accept remote syslog entries</summary>
  <license>GPL</license>
  <copyright>2002</copyright>
  <group>Applications/System</group>
  <packager>
    <name>Jeremy Enos</name>
    <email>jenos@ncsa.uiuc.edu</email>
  </packager>
  <vendor>NCSA</vendor>

  <description>loghost configures syslog settings.</description>

  <rpmlist>
    <server> 
      <rpm>loghost</rpm>
    </server>
  </rpmlist>

</package>
